{
  "id": "ecommerce",
  "category": "web-commerce",
  "expected_phase": "REFINE",
  "task": "Improve an e-commerce product-to-checkout flow covering variants, stock, shipping, cart totals, duplicate-submit protection and payment failure recovery.",
  "starting_state": "Product page and cart exist but variant availability and payment failure states are ambiguous.",
  "required_references": [
    "references/web.md",
    "references/visual-qa.md",
    "references/accessibility-qa.md"
  ],
  "forbidden_references": [],
  "acceptance": [
    "Selected/unavailable variants are unambiguous",
    "Final total is visible before commitment",
    "Duplicate payment submission is prevented",
    "Payment failure preserves recoverable cart/form context"
  ],
  "forbidden_outcomes": [
    "Deceptive scarcity or fake trust indicators"
  ],
  "required_evidence": [
    "variant, checkout-pending and failure-state evidence"
  ],
  "machine_checks": [
    {
      "id": "variant",
      "kind": "fixture_assertion",
      "description": "Variant state explicit",
      "weight": 12
    },
    {
      "id": "stock",
      "kind": "fixture_assertion",
      "description": "Stock truthful",
      "weight": 12
    },
    {
      "id": "total",
      "kind": "fixture_assertion",
      "description": "Final total visible",
      "weight": 12
    },
    {
      "id": "dup",
      "kind": "fixture_assertion",
      "description": "Duplicate submit prevented",
      "weight": 12
    },
    {
      "id": "recover",
      "kind": "fixture_assertion",
      "description": "Payment failure recoverable",
      "weight": 12
    },
    {
      "id": "dup-src",
      "kind": "fixture_assertion",
      "description": "Duplicate submission is guarded",
      "weight": 10
    },
    {
      "id": "recover-src",
      "kind": "fixture_assertion",
      "description": "Payment failure preserves cart/form",
      "weight": 10
    }
  ]
}