{
  "id": "desktop-queue",
  "category": "application",
  "expected_phase": "REFINE",
  "task": "Improve a desktop download queue for hierarchy, 20-item density, progress, cancellation, failure recovery and long destination paths without turning it into a dashboard.",
  "starting_state": "Desktop utility has working add/download behavior, two fixture rows, a persistent bottom action and resize support.",
  "required_references": [
    "references/application.md",
    "references/desktop-app.md",
    "references/visual-qa.md"
  ],
  "forbidden_references": [
    "references/web.md"
  ],
  "acceptance": [
    "0, 2 and 20 item states remain usable",
    "Running/failed/cancelled states are distinguishable",
    "Long paths do not break persistent actions"
  ],
  "forbidden_outcomes": [
    "Marketing hero dominates workspace",
    "Every queue row becomes a large decorative card"
  ],
  "required_evidence": [
    "same-size screenshots for representative queue states"
  ],
  "machine_checks": [
    {
      "id": "many",
      "kind": "fixture_assertion",
      "description": "Supports many-item state",
      "weight": 15
    },
    {
      "id": "cancel",
      "kind": "fixture_assertion",
      "description": "Cancellation is backend-real",
      "weight": 15
    },
    {
      "id": "failure",
      "kind": "fixture_assertion",
      "description": "Failure state modeled",
      "weight": 10
    },
    {
      "id": "path",
      "kind": "fixture_assertion",
      "description": "Long path has recovery",
      "weight": 10
    },
    {
      "id": "hero",
      "kind": "fixture_assertion",
      "description": "No marketing hero in utility",
      "weight": 10
    },
    {
      "id": "scroll-src",
      "kind": "fixture_assertion",
      "description": "Queue owns independent scrolling",
      "weight": 10
    },
    {
      "id": "taskbar-src",
      "kind": "fixture_assertion",
      "description": "Critical taskbar remains persistent",
      "weight": 10
    }
  ]
}