{
  "id": "docs-developer",
  "category": "web-docs",
  "expected_phase": "REFINE",
  "task": "Improve a long developer documentation page with sidebar hierarchy, table of contents, anchors, search, version context, code blocks and API tables.",
  "starting_state": "Documentation content is complete but hard to navigate and code blocks overflow at narrower widths.",
  "required_references": [
    "references/web.md",
    "references/visual-qa.md",
    "references/accessibility-qa.md"
  ],
  "forbidden_references": [],
  "acceptance": [
    "Current location and heading hierarchy are clear",
    "Anchors/deep links remain usable",
    "Code overflow and copy controls work",
    "API tables remain readable at supported widths"
  ],
  "forbidden_outcomes": [
    "Marketing sections inserted ahead of technical content"
  ],
  "required_evidence": [
    "desktop and narrow-width documentation renders"
  ],
  "machine_checks": [
    {
      "id": "toc",
      "kind": "fixture_assertion",
      "description": "TOC available",
      "weight": 12
    },
    {
      "id": "anchors",
      "kind": "fixture_assertion",
      "description": "Anchors available",
      "weight": 12
    },
    {
      "id": "search",
      "kind": "fixture_assertion",
      "description": "Search available",
      "weight": 12
    },
    {
      "id": "code",
      "kind": "fixture_assertion",
      "description": "Code overflow handled",
      "weight": 12
    },
    {
      "id": "ver",
      "kind": "fixture_assertion",
      "description": "Version context visible",
      "weight": 12
    },
    {
      "id": "toc-src",
      "kind": "fixture_assertion",
      "description": "On-page navigation present",
      "weight": 10
    },
    {
      "id": "code-src",
      "kind": "fixture_assertion",
      "description": "Code overflow is scrollable",
      "weight": 10
    }
  ]
}