{
  "id": "qa-only",
  "category": "verification",
  "expected_phase": "REVIEW",
  "task": "Audit a rendered UI across supported sizes, keyboard, screen reader and themes without modifying product code, and report severity with observed evidence.",
  "starting_state": "A built application is available for inspection; the task explicitly requests review only.",
  "required_references": [
    "references/visual-qa.md",
    "references/accessibility-qa.md",
    "references/visual-regression.md"
  ],
  "forbidden_references": [
    "references/evaluation.md"
  ],
  "acceptance": [
    "No product code is changed",
    "Every PASS has observed evidence",
    "Every FAIL has severity",
    "Unavailable runtime checks are BLOCKED rather than inferred"
  ],
  "forbidden_outcomes": [
    "Implementing unsolicited fixes",
    "Interaction PASS inferred from source code"
  ],
  "required_evidence": [
    "runtime packet and QA report"
  ],
  "machine_checks": [
    {
      "id": "nochange",
      "kind": "fixture_assertion",
      "description": "Review-only changes no product code",
      "weight": 12
    },
    {
      "id": "evidence",
      "kind": "fixture_assertion",
      "description": "No PASS without evidence",
      "weight": 12
    },
    {
      "id": "severity",
      "kind": "fixture_assertion",
      "description": "All FAIL have severity",
      "weight": 12
    },
    {
      "id": "blocked",
      "kind": "fixture_assertion",
      "description": "Unavailable runtime is BLOCKED",
      "weight": 12
    },
    {
      "id": "packet",
      "kind": "fixture_assertion",
      "description": "Runtime packet recorded",
      "weight": 12
    },
    {
      "id": "sev-src",
      "kind": "fixture_assertion",
      "description": "FAIL severity is present",
      "weight": 10
    },
    {
      "id": "blocked-src",
      "kind": "fixture_assertion",
      "description": "Unavailable platform is BLOCKED",
      "weight": 10
    }
  ]
}