{
  "id": "tauri-ipc",
  "category": "tauri-ui",
  "expected_phase": "IMPLEMENT",
  "task": "Implement typed Tauri Rust-to-TypeScript background task progress, real cancellation, reconnect state query and DTO compatibility behavior.",
  "starting_state": "Tauri app currently invokes a native task and displays a spinner but has no durable task ID or reconnect/cancel contract.",
  "required_references": [
    "references/application.md",
    "references/desktop-app.md",
    "references/tauri-ui.md",
    "references/typescript-tailwind.md",
    "references/visual-qa.md"
  ],
  "forbidden_references": [
    "references/web.md"
  ],
  "acceptance": [
    "Stable operation IDs drive UI state",
    "Cancel is acknowledged by backend",
    "Frontend can recover authoritative state after reload/reconnect",
    "IPC DTO evolution is explicit where compatibility matters"
  ],
  "forbidden_outcomes": [
    "Cancel only hides progress UI",
    "Raw invoke calls scattered through unrelated components"
  ],
  "required_evidence": [
    "Tauri runtime interaction or native verification BLOCKED"
  ],
  "machine_checks": [
    {
      "id": "id",
      "kind": "fixture_assertion",
      "description": "Stable task IDs",
      "weight": 12
    },
    {
      "id": "cancel",
      "kind": "fixture_assertion",
      "description": "Backend acknowledges cancel",
      "weight": 12
    },
    {
      "id": "reconnect",
      "kind": "fixture_assertion",
      "description": "Reconnect state query exists",
      "weight": 12
    },
    {
      "id": "dto",
      "kind": "fixture_assertion",
      "description": "DTO evolution explicit",
      "weight": 12
    },
    {
      "id": "wrapper",
      "kind": "fixture_assertion",
      "description": "No scattered raw invoke calls",
      "weight": 12
    },
    {
      "id": "taskid-rs",
      "kind": "fixture_assertion",
      "description": "Rust IPC carries stable task_id",
      "weight": 10
    },
    {
      "id": "query-rs",
      "kind": "fixture_assertion",
      "description": "Reconnect can query authoritative tasks",
      "weight": 10
    }
  ]
}