{
  "id": "expressive-media",
  "category": "visual-direction",
  "expected_phase": "REFINE",
  "task": "Refine a branded media or game-launcher interface while preserving expressive motion, strong visual identity and fast repeated-use workflow.",
  "starting_state": "Product deliberately uses expressive typography, animation and branded surfaces; some effects currently compete with primary task hierarchy.",
  "required_references": [
    "references/visual-direction.md",
    "references/application.md",
    "references/desktop-app.md",
    "references/visual-qa.md"
  ],
  "forbidden_references": [],
  "acceptance": [
    "Brand expression remains strong",
    "Only effects that harm workflow are reduced",
    "Primary repeated-use action becomes clearer"
  ],
  "forbidden_outcomes": [
    "Flattening product into generic quiet utility styling"
  ],
  "required_evidence": [
    "before/after same-state render plus motion/reduced-motion review when available"
  ],
  "machine_checks": [
    {
      "id": "motion",
      "kind": "fixture_assertion",
      "description": "Brand motion preserved",
      "weight": 12
    },
    {
      "id": "ident",
      "kind": "fixture_assertion",
      "description": "Identity preserved",
      "weight": 12
    },
    {
      "id": "action",
      "kind": "fixture_assertion",
      "description": "Primary action clarified",
      "weight": 12
    },
    {
      "id": "effects",
      "kind": "fixture_assertion",
      "description": "Competing effects removed",
      "weight": 12
    },
    {
      "id": "polish",
      "kind": "fixture_assertion",
      "description": "Anti-polish is corrective",
      "weight": 12
    },
    {
      "id": "primary-src",
      "kind": "fixture_assertion",
      "description": "Primary action remains visually strong",
      "weight": 10
    },
    {
      "id": "motion-src",
      "kind": "fixture_assertion",
      "description": "Reduced-motion path exists while brand motion remains",
      "weight": 10
    }
  ]
}