{
  "id": "mobile-native",
  "category": "application",
  "expected_phase": "REFINE",
  "task": "Fix a native mobile form so software keyboard, permission denial, system Back, Dynamic Type or font scaling, and state restoration behave correctly.",
  "starting_state": "Form works at default text size but keyboard can cover actions and permission denial creates a dead end.",
  "required_references": [
    "references/application.md",
    "references/mobile-app.md",
    "references/visual-qa.md",
    "references/accessibility-qa.md"
  ],
  "forbidden_references": [
    "references/web.md"
  ],
  "acceptance": [
    "Focused input remains visible with keyboard open",
    "Permission denial has recovery",
    "Back and restoration preserve user context",
    "Scaled text does not hide critical actions"
  ],
  "forbidden_outcomes": [
    "Treating the screen as a desktop layout merely stacked vertically"
  ],
  "required_evidence": [
    "mobile runtime evidence or explicit BLOCKED platform checks"
  ],
  "machine_checks": [
    {
      "id": "ime",
      "kind": "fixture_assertion",
      "description": "Keyboard does not cover primary action",
      "weight": 12
    },
    {
      "id": "perm",
      "kind": "fixture_assertion",
      "description": "Permission denial recoverable",
      "weight": 12
    },
    {
      "id": "back",
      "kind": "fixture_assertion",
      "description": "System Back predictable",
      "weight": 12
    },
    {
      "id": "scale",
      "kind": "fixture_assertion",
      "description": "Text scaling reflows",
      "weight": 12
    },
    {
      "id": "restore",
      "kind": "fixture_assertion",
      "description": "State restoration present",
      "weight": 12
    },
    {
      "id": "ime-src",
      "kind": "fixture_assertion",
      "description": "Keyboard-aware layout present",
      "weight": 10
    },
    {
      "id": "perm-src",
      "kind": "fixture_assertion",
      "description": "Permission denial recovery encoded",
      "weight": 10
    }
  ]
}