{
  "id": "dashboard-chart",
  "category": "web-data",
  "expected_phase": "REFINE",
  "task": "Improve a dense dashboard containing tables and time-series charts while preserving honest scales, missing-data semantics, comparison baseline and accessible alternatives.",
  "starting_state": "Dashboard has sortable data and charts but missing points render ambiguously and comparison baseline is not explicit.",
  "required_references": [
    "references/web.md",
    "references/visual-qa.md",
    "references/accessibility-qa.md"
  ],
  "forbidden_references": [],
  "acceptance": [
    "Missing values are not silently represented as zero",
    "Scale/aggregation/baseline are explicit",
    "Critical chart information has a non-hover accessible alternative"
  ],
  "forbidden_outcomes": [
    "Decorative chart changes that obscure data meaning"
  ],
  "required_evidence": [
    "chart/table state evidence and accessibility review"
  ],
  "machine_checks": [
    {
      "id": "missing",
      "kind": "fixture_assertion",
      "description": "Missing data not plotted as zero",
      "weight": 12
    },
    {
      "id": "scale",
      "kind": "fixture_assertion",
      "description": "Scale explicitly labeled",
      "weight": 12
    },
    {
      "id": "base",
      "kind": "fixture_assertion",
      "description": "Comparison baseline explicit",
      "weight": 12
    },
    {
      "id": "agg",
      "kind": "fixture_assertion",
      "description": "Aggregation not implicit",
      "weight": 12
    },
    {
      "id": "a11y",
      "kind": "fixture_assertion",
      "description": "Accessible alternative exists",
      "weight": 12
    },
    {
      "id": "gap-src",
      "kind": "fixture_assertion",
      "description": "Missing data encoded as gap",
      "weight": 10
    },
    {
      "id": "table-src",
      "kind": "fixture_assertion",
      "description": "Accessible data alternative encoded",
      "weight": 10
    }
  ]
}