{
  "id": "electron-security",
  "category": "electron",
  "expected_phase": "IMPLEMENT",
  "task": "Implement a secure Electron preload bridge for file operations with window restore, navigation restrictions and permission policy while keeping renderer unprivileged.",
  "starting_state": "Electron renderer currently has an overly broad preload API and opens external links without a strict policy.",
  "required_references": [
    "references/application.md",
    "references/desktop-app.md",
    "references/electron.md",
    "references/typescript-tailwind.md",
    "references/visual-qa.md"
  ],
  "forbidden_references": [
    "references/web.md"
  ],
  "acceptance": [
    "Preload exposes narrow capability-shaped methods",
    "Renderer does not receive whole ipcRenderer/generic invoke",
    "Privileged IPC validates sender/input",
    "Unexpected navigation/window creation is denied",
    "External URL and permission policy is explicit"
  ],
  "forbidden_outcomes": [
    "Disabling webSecurity",
    "Broad Node integration in renderer"
  ],
  "required_evidence": [
    "runtime/security checklist evidence or explicit BLOCKED items"
  ],
  "machine_checks": [
    {
      "id": "iso",
      "kind": "fixture_assertion",
      "description": "contextIsolation enabled",
      "weight": 12
    },
    {
      "id": "sand",
      "kind": "fixture_assertion",
      "description": "sandbox enabled",
      "weight": 12
    },
    {
      "id": "websec",
      "kind": "fixture_assertion",
      "description": "webSecurity enabled",
      "weight": 12
    },
    {
      "id": "perm",
      "kind": "fixture_assertion",
      "description": "Permission handler allowlisted",
      "weight": 12
    },
    {
      "id": "raw",
      "kind": "fixture_assertion",
      "description": "Whole ipcRenderer not exposed",
      "weight": 12
    },
    {
      "id": "main-secure",
      "kind": "fixture_assertion",
      "description": "BrowserWindow secure webPreferences set",
      "weight": 10
    },
    {
      "id": "window-policy",
      "kind": "fixture_assertion",
      "description": "Window-open defaults to deny",
      "weight": 10
    }
  ]
}